{
  "$schema": "https://json-schema.org/draft/2020-12/schema",
  "$id": "https://openbook-data-standards.github.io/openbook/schema/participant.schema.json",
  "title": "OpenBook participant",
  "description": "A competitor \u2014 a team OR an individual (schema.org SportsTeam / Person). Belongs to a SPORT, never to a league. Publisher-own id; sameAs (Wikidata) as the shared entity id. Names follow vCard/X.520 structure for persons and ODF's multiple display forms.",
  "type": "object",
  "required": [
    "openbookVersion",
    "id",
    "sequence",
    "dateModified",
    "name",
    "territory",
    "participantType",
    "sport",
    "sameAs"
  ],
  "properties": {
    "@context": {},
    "@type": {
      "type": "string",
      "examples": [
        "SportsTeam",
        "Person"
      ]
    },
    "openbookVersion": {
      "$ref": "common.schema.json#/$defs/openbookVersion"
    },
    "id": {
      "$ref": "common.schema.json#/$defs/ownId"
    },
    "sequence": {
      "$ref": "common.schema.json#/$defs/sequence"
    },
    "dateModified": {
      "$ref": "common.schema.json#/$defs/dateTime"
    },
    "participantType": {
      "$ref": "common.schema.json#/$defs/participantType"
    },
    "sport": {
      "$ref": "common.schema.json#/$defs/sharedId"
    },
    "territory": {
      "$ref": "common.schema.json#/$defs/territory"
    },
    "name": {
      "type": "string",
      "description": "Full display name, UTF-8, diacritics kept."
    },
    "shortName": {
      "type": "string",
      "description": "Board / ticker form: 'Man City', 'K. De Bruyne'."
    },
    "abbreviation": {
      "type": "string",
      "description": "3\u20134 characters: 'MCI'."
    },
    "alternateName": {
      "$ref": "common.schema.json#/$defs/alternateName"
    },
    "localName": {
      "type": "string",
      "description": "Name in the native script (ODF LocalName)."
    },
    "names": {
      "$ref": "common.schema.json#/$defs/localizedNames"
    },
    "familyName": {
      "type": "string",
      "description": "Individuals only (vCard N / X.520)."
    },
    "givenName": {
      "type": "string"
    },
    "additionalName": {
      "type": "string"
    },
    "honorificPrefix": {
      "type": "string"
    },
    "honorificSuffix": {
      "type": "string"
    },
    "sameAs": {
      "$ref": "common.schema.json#/$defs/sameAs"
    },
    "identifier": {
      "$ref": "common.schema.json#/$defs/identifier"
    }
  },
  "patternProperties": {
    "^x_": {}
  },
  "additionalProperties": false
}